{
  "schema_version": 1,
  "job_id": "job-fixture01",
  "sponsor_id": "synthetic-user-a",
  "runtime_role": "RA05",
  "purpose": "Compare candidate fixture specifications offline",
  "input_refs": [
    "design-fixture01"
  ],
  "allowed_capabilities": [
    "synthetic.read",
    "proposal.create"
  ],
  "max_iterations": 3,
  "max_tool_calls": 0,
  "wall_seconds_limit": 60,
  "maximum_spend_usd": 0,
  "state": "PROPOSED",
  "physical_execution_enabled": false,
  "external_network_enabled": false
}
